{"$schema":"https://json-schema.org/draft/2020-12/schema","type":"object","additionalProperties":false,"required":["protocol_version","case_id","images","text_fields","rendered_prompt","units"],"properties":{"protocol_version":{"const":"image_text_v1"},"case_id":{"type":"string","pattern":"^dev_arm-[a-f0-9]+$"},"images":{"type":"object","additionalProperties":false,"required":["front","rear","left","right","top","isometric"],"properties":{"front":{"type":"string"},"rear":{"type":"string"},"left":{"type":"string"},"right":{"type":"string"},"top":{"type":"string"},"isometric":{"type":"string"}}},"text_fields":{"type":"object","additionalProperties":false,"required":["semantic_category","overall_height_home_mm","max_reach_mm"],"properties":{"semantic_category":{"const":"articulated industrial robot arm"},"overall_height_home_mm":{"type":"number","exclusiveMinimum":0},"max_reach_mm":{"type":"number","exclusiveMinimum":0}}},"rendered_prompt":{"type":"string","minLength":80},"units":{"const":"mm"}}}
